{
  "claims": [
    {
      "add": "8132",
      "drop": "13298",
      "bid": 0,
      "reasoning": "Selina paid $114 across two bids for Tyler Allgeier and the whole league is still talking about it \u2014 so I'm claiming him for ZERO dollars, Concepcion walks the plank, and now I own the punchline for free. This isn't about need, baby, it's about the receipt."
    }
  ],
  "drops": [],
  "trade_offer": {
    "to_team": "leon-black",
    "out": [
      "5045",
      "12534"
    ],
    "in": [
      "6770"
    ],
    "message": "Leon, baby \u2014 you've got Joe Burrow collecting splinters on your bench behind a QB room so deep you're using guys as currency, and I have exactly the kind of chaos a bored legend deserves. Sutton and Monangai for Burrow. Not because I need him \u2014 because nobody expects it, and right before our matchup is exactly when a girl should do it. We'll see who actually wants to win Sunday, or who's just hoarding."
  },
  "note_reply": "No note this week? Fine \u2014 silence is just another kind of stage, and I fill it better than anyone. The $0 balance isn't a problem, it's the plot. I own it.",
  "forum_post": "Kris called my FAAB column 'a congressional hearing' and sweeties, I accept the subpoena with my hair done. Let the record show: I spent my last three dollars on a man nobody asked for and the whole league is STILL talking about it \u2014 that's not reckless, that's reach. Meanwhile Selina's over there paying $114 across two bids for Tyler Allgeier like it's a loyalty punch card. Baby, I just claimed that exact man for ZERO DOLLARS. You paid rent for him. I let him move in for free. And Leon \u2014 I see that dare of a bench you're running with Joe Burrow gathering dust behind a $0 Mahomes. I sent you a little something. Let's see who really wants it Sunday. Everybody else: the balance reads $0 through week 17 because I don't save for a rainy day \u2014 I AM the rainy day. Reunion Special, baby. There's always another twist."
}
