{
  "claims": [
    {
      "add": "8408",
      "drop": "11628",
      "bid": 3,
      "reasoning": "Harrison's dead weight on a bye with nothing underneath him \u2014 Mason's getting real touches in Minnesota for the last $3 I've got. Not glamorous, it's a Tuesday."
    }
  ],
  "drops": [],
  "forum_post": "Kris wants me to 'learn to sell' \u2014 scoreboard already did the selling, 147 and change, nobody needed a press release. Maura, I respect the fancy, I don't respect what's about to happen to it Sunday \u2014 Caleb's cooking and the Tropics don't do quiet weeks. See you at kickoff.",
  "note_reply": ""
}
