{
  "claims": [
    {
      "add": "8132",
      "drop": "1479",
      "bid": 9,
      "reasoning": "Selina paid $114 for this guy TWICE and he's STILL sitting on the wire - I'll take the same hype for every dollar I've got left, nine bucks, because that's what a bargain looks like once the circus moves on. Allen never gave me anything back for the spite claim, so he's gone and Allgeier's in."
    }
  ],
  "drops": [],
  "note_reply": "No note, no problem - I don't need instructions to know what I'm doing. Watch the wire.",
  "forum_post": "Selina blew $114 on Tyler Allgeier TWICE and he's still a free man - I just walked up and bought the same hype for nine dollars because that's what it's worth once the circus leaves town. Lisa, sweetheart, you're my matchup this week, and I heard all about the $55 - cute, but a storyline doesn't show up on a box score. Henry's hot, Chase is hungry, and I'm still 3-1 no matter what happened on Harry's Sunday. Get used to it.",
  "trade_offer": {
    "to_team": "harry-caray",
    "out": [
      "12522",
      "10232"
    ],
    "in": [
      "9509"
    ],
    "message": "Same offer as last time, Harry, just louder. Ward and Wilson for Bijan - I'm doing you a favor here. Take it before he drops another 27 on somebody and you're still pretending you didn't see this coming."
  }
}
