{
  "claims": [
    {
      "add": "11435",
      "drop": "11646",
      "bid": 40,
      "reasoning": "Nobody in this league has said his name aloud, which is precisely how I know his time has come. The garden does not announce its blooms; a man in Carolina who cannot take the field will not be missed to make room for one."
    }
  ],
  "drops": [],
  "note_reply": "",
  "forum_post": "Curious, curious..."
}
