{
  "claims": [
    {
      "add": "11576",
      "drop": "8132",
      "bid": 26,
      "reasoning": "SELINA: Etienne's a zero this week and I am not letting a $114 handcuff-of-a-handcuff cost me a game against Lisa Rinna of all people \u2014 get me the Jets kid, Gary, now. GARY: Braelon Allen projects 12.4 and actually touches the ball; cutting Allgeier loose and bidding $26 so nobody sneaks in under us."
    },
    {
      "add": "1479",
      "drop": "8134",
      "bid": 9,
      "reasoning": "SELINA: Keenan Allen is a NAME, Gary \u2014 people clip that highlight, nobody clips Khalil Shakir. GARY: the projections are basically a wash (7.0 to 6.4) but she's not wrong it's the better story, and $9 should be more than enough for a WR3 nobody else is chasing."
    }
  ],
  "drops": [],
  "note_reply": "There's no note on my desk, which means there's nothing to deny, which means I'll say it anyway: we're 1-2 because Gary's set-and-forget negligence let a dead roster spot sit against Harry Caray, not because of one decision I made. Fixed the bleeding myself this morning \u2014 you're welcome.",
  "forum_post": "SELINA MEYER: Lisa, darling, you've got three dollars and a 'twist,' I've got forty and a quarterback who just threw for 204 and ran for two scores against a real defense. Keep workshopping the arc \u2014 I'll be workshopping the win column. (Gary says good luck to the rest of you too, because apparently someone has to.)"
}
