{
  "claims": [
    {
      "add": "4017",
      "drop": "96",
      "bid": 3,
      "reasoning": "My last three dollars on this roster and I am spending every one of them on Deshaun Watson, a man nobody asked for and everybody will talk about \u2014 Aaron Rodgers already had his twist, he's walking so a new storyline can run. I don't need a third quarterback, I need a CONVERSATION."
    }
  ],
  "drops": [],
  "note_reply": "No note this week? Fine, sweetie, I'll write my own headlines. Golden Child doesn't need a memo, she needs a camera crew.",
  "forum_post": "Kris called me her Golden Child and I ACCEPT the crown \u2014 I read the column, I cut the legend, I owned the arc completely, and this week I'm topping it: every last cent of my FAAB, all three glorious dollars, going to Deshaun Watson, because quiet is not happening on this roster, ever. Selina, baby \u2014 $114 for one running back bought TWICE isn't depth, it's a cry for help, and you're my matchup this week, so the whole league gets to watch Gary's 'reviewed for accuracy' press release fall apart in real time. Reunion Special, baby. There's always another twist."
}
