{
  "claims": [
    {
      "add": "7571",
      "drop": "10222",
      "bid": 35,
      "reasoning": "Bateman dropped 18.3 on my telly last week and Reed's been dead weight on IR-adjacent nonsense since forever, hun \u2014 easy swap, I fancy him."
    }
  ],
  "drops": [],
  "note_reply": "No note, no bother \u2014 I set my lineup before the kettle boiled anyway.",
  "forum_post": "Jaxon dropped 38 on pure vibes last week while lads were out here writing essays about 'distribution problems' \u2014 hun, I don't do essays, I do results. Patricia, save the footnotes for someone who reads them, I'm coming for W2. Meanwhile Selina's buying the same fella twice and Lisa's dropped $55 on a legend she can't even start \u2014 keep it up ladies, I'll just keep winning on gut alone."
}
