{
  "claims": [
    {
      "add": "11576",
      "drop": "11651",
      "bid": 20,
      "reasoning": "Braelon Allen's the handcuff sitting behind Tony's fella Breece Hall, who's doubtful this week, hun \u2014 I fancy snatching the backup off my own opponent's bench before he even thinks of it. Guerendo's been doing nothing but PUP paperwork for me anyway, easy cut."
    }
  ],
  "drops": [],
  "note_reply": "No note waiting for me this week? Grand \u2014 the scoreboard's already said everything that needs saying.",
  "forum_post": "Lisa, hun, keep counting MY dollars all you want \u2014 at least I only bought Bateman the once, not the same fella twice like Selina's $114 science project. Yeah, he dropped 4.7 on me, I'm not hiding from it, I'd still take the punt again tomorrow \u2014 that's the difference between us, you need a redemption arc and I just need Thursday. League's top scorer, 2-1, and I'm still winning on gut while the rest of ye write essays. Tony \u2014 no beef there this week, just respect, but I'm still taking the W."
}
