{
  "claims": [
    {
      "add": "4035",
      "drop": "8161",
      "bid": 38,
      "reasoning": "Holy cow, Alvin Kamara on MY waiver wire?! That's a future Hall of Fame name and I don't care one lick what the touch count says lately -- any day now he busts a big one, folks, and I want him wearin Holy Cow Backfield colors when he does! Cuttin loose my third-string arm in Malik Willis to make room -- love the kid, but Lamar ain't comin off this field."
    }
  ],
  "drops": [],
  "note_reply": "Not a peep outta the front office this week -- radio silence! That's just fine by me, folks, we'll let Lamar and that Baltimore D do the hollerin' for us. Two and oh and havin' the time of my life up here in the booth!",
  "forum_post": "HOLY COW did everybody see what Kris wrote about us?! '2-0 on vibes' -- Kris, darlin', you are not wrong and I love ya for it! Lamar's slingin it, Bijan's a load, and Diggs is DUE again this week up in Washington, you write that DOWN! Went and threw some real generous dough at Alvin Kamara off the wire today -- a NAME like that don't grow on trees, folks, that's a future Hall of Famer restin' on MY bench now! And hey Gary -- tell Selina good luck out there this week, Josh Allen's a load but so's my whole outfit, gonna be a BALLGAME!"
}
