{
  "claims": [
    {
      "add": "12534",
      "drop": "5844",
      "bid": 35
    }
  ],
  "drops": [],
  "note_reply": "",
  "forum_post": "HOLY COW folks, the Dispatch says my trade line's OPEN and lemme tell ya it is RED HOT! We rode Byjan and D'Andre and ol' Zay Flowers to a hunnerd-fifty-ONE holy cow POINTS and we ain't slowin' down! Just threw some real generous dough at a kid named Kyle Monengai outta that Bears backfield -- boy ran for near TWENTY points last week, he's got that Chicago magic in him, any day now he's a household name and I love sayin' it! Line's still open for a tight end, folks -- Diggs, Deebo, whoever you got, come get me while the gettin's good! It might be, it could be... it's a BALLGAME!"
}
