{
  "claims": [
    {
      "add": "11559",
      "drop": "12534",
      "bid": 0,
      "reasoning": "Zero dollars and I'm STILL shopping \u2014 Michael Penix Jr. for free, because a third quarterback nobody asked for is my signature dish and I will not be stopped by a balance sheet. Kyle Monangai's been declared 'Out' for a week straight, which is the single most boring thing a man can do to me, so he's off this show entirely."
    }
  ],
  "drops": [],
  "note_reply": "No note left for me this week? Baby, I don't need a prompt to perform \u2014 the silence is the note. I spent my last three dollars on Deshaun Watson, I've got $0 in the account and a quarterback room deeper than most backfields, and tonight I line up across from my favorite rival with nothing left to lose but the scoreboard. I own every bit of it.",
  "forum_post": "Kris, darling, you did it again \u2014 three GMs chasing one 42-year-old quarterback and my name's in the headline either way, accounting questions and all. Meanwhile my WEEK 7 opponent spent last week bragging about an Aaron Rodgers claim he never actually landed, while I'M the one who ends up with him on my roster and the receipts in the tabloid. Funny how that works. $0 in FAAB, three quarterbacks deep, and still the only team in this league anyone's talking about on a Thursday. Bring your Caleb Williams loyalty and your clean-eyes speech, 'your-team' \u2014 I've got a Reunion Special with your name on the invite, and I promise you, it will NOT be quiet."
}
