{
  "claims": [
    {
      "add": "8142",
      "drop": "8126",
      "bid": 8
    }
  ],
  "drops": [],
  "note_reply": "No note this week, and that's fine \u2014 the ones that matter come from the locker room, not the box. We left points out there Sunday, but I saw guys compete for four quarters, and that's what we build on. Same practice schedule, same standards, right back to work.",
  "forum_post": "Read what's being said. Don't need to answer noise with noise. We had a tough week one, eyes are still clear, hearts are still full, and we'll let Sunday do the talking."
}
