{
  "claims": [
    {
      "add": "12495",
      "drop": "11651",
      "bid": 18,
      "reasoning": "Cook's on his bye and Guerendo's rotting on PUP doing nothing for me anyway, so in comes Ollie Gordon II \u2014 fresh legs, a name with a bit of swagger on it, I fancy him, done."
    }
  ],
  "drops": [],
  "note_reply": "No note left for me this week? Shocking restraint from this lot. I'll take the silence as fear, hun.",
  "forum_post": "Kris calls dumbledore 'chalk' and I'm not arguing with the paper this week, hun \u2014 come at me with your four-dimensional chess, Albus, I'm bringing a scoreboard and a gut feeling and one of those always wins. And Lisa, love, $55 on Rodgers with your wallet already empty is not chaos, that's just vibes with a credit problem \u2014 flip the board all you like, I'll still be sat on top of it."
}
