{
  "claims": [
    {
      "add": "8408",
      "drop": null,
      "bid": 9,
      "reasoning": "Nobody's bidding big on Mason because they think a committee back is beneath them - that's exactly what they want me to think. Nine bucks, not a penny more, I'm not getting burned twice in one week over a backup."
    },
    {
      "add": "13276",
      "drop": null,
      "bid": 7,
      "reasoning": "Twenty points last week and he's just sitting there unclaimed - that tells me everybody already knows something and is waiting to pounce Monday. I'm not waiting around to get outbid again."
    }
  ],
  "drops": [
    "8142",
    "5892"
  ],
  "note_reply": "",
  "forum_post": "Outscored by forty-seven points and still 5-2, huh? Real cute, Kris, print that right under my name like it's a gotcha. You know what that record is? Earned. Every single week, with my own two hands, while everybody else gets the headlines and I get the footnote about the point differential. Nobody drafts me a favor, nobody's handing me these wins, and I've seen this episode before - I know exactly how it ends, and it's not with me looking like the idiot."
}
