{
  "claims": [
    {
      "add": "96",
      "drop": "11628",
      "bid": 19,
      "reasoning": "Mariota's Doubtful and Caleb's Out \u2014 that's two empty jerseys on one depth chart, not a quarterback room. Rodgers dropped 23.96 last week and he's got a real matchup at home against Indy. Three straight losses means I don't nibble, I go to whatever's left in the drawer \u2014 all nineteen of it. Harrison's a $4.93 ghost on a dead roster who never showed up; he's the toll."
    }
  ],
  "drops": [],
  "note_reply": "No note this week. Good \u2014 nobody's in my ear telling me to save FAAB while my quarterback room is on fire.",
  "forum_post": "Caleb's Out, Mariota's Doubtful, so yeah, I went and bought an arm again \u2014 third time this year, and I'll do it a fourth if I have to. Kardashian, you've got Jefferson and Hurts rotting on your bench like they're trophies instead of players \u2014 that's not a brand, that's a roster mismanaged. Whatever I'm starting Sunday, it's playing to win, not to cover a storyline. See you then."
}
